<?xml version="1.0" encoding="UTF-8"?>
<?xml-stylesheet type="text/xsl" href="mobiles.xsl"?>

<MobileSales xmlns:xsi="http://www.w3.org/2001/XMLSchema-instance"
             xsi:noNamespaceSchemaLocation="mobiles.xsd">
    <Mobile>
        <ModelID>1234</ModelID>
        <Brand>Motorola</Brand>
        <Price>1000</Price>
        <Color>Black</Color>
        <SIMSize>Micro</SIMSize>
        <Memory>8GB</Memory>
        <Camera>Yes</Camera>
        <TouchScreen>Yes</TouchScreen>
        <NoSold>11</NoSold>
        <storeName>store1</storeName>
    </Mobile>
    <Mobile>
        <ModelID>3452</ModelID>
        <Brand>Micromax</Brand>
        <Price>7000</Price>
        <Color>Black</Color>
        <SIMSize>Micro</SIMSize>
        <Memory>8GB</Memory>
        <Camera>Yes</Camera>
        <TouchScreen>Yes</TouchScreen>
        <NoSold>6</NoSold>
        <storeName>store1</storeName>
    </Mobile>
    <Mobile>
        <ModelID>6878</ModelID>
        <Brand>Lenovo</Brand>
        <Price>6000</Price>
        <Color>White</Color>
        <SIMSize>Nano</SIMSize>
        <Memory>4GB</Memory>
        <Camera>Yes</Camera>
        <TouchScreen>Yes</TouchScreen>
        <NoSold>8</NoSold>
        <storeName>store1</storeName>
    </Mobile>
    <Mobile>
        <ModelID>1284</ModelID>
        <Brand>Motorola</Brand>
        <Price>4000</Price>
        <Color>Black</Color>
        <SIMSize>Micro</SIMSize>
        <Memory>8GB</Memory>
        <Camera>Yes</Camera>
        <TouchScreen>Yes</TouchScreen>
        <NoSold>5</NoSold>
        <storeName>store2</storeName>
    </Mobile>
    <Mobile>
        <ModelID>3452</ModelID>
        <Brand>Micromax</Brand>
        <Price>7000</Price>
        <Color>Black</Color>
        <SIMSize>Micro</SIMSize>
        <Memory>8GB</Memory>
        <Camera>Yes</Camera>
        <TouchScreen>Yes</TouchScreen>
        <NoSold>17</NoSold>
        <storeName>store2</storeName>
    </Mobile>
    <Mobile>
        <ModelID>1234</ModelID>
        <Brand>Motorola</Brand>
        <Price>4000</Price>
        <Color>Black</Color>
        <SIMSize>Micro</SIMSize>
        <Memory>8GB</Memory>
        <Camera>Yes</Camera>
        <TouchScreen>Yes</TouchScreen>
        <NoSold>7</NoSold>
        <storeName>store3</storeName>
    </Mobile>
    <Mobile>
        <ModelID>6878</ModelID>
        <Brand>Lenovo</Brand>
        <Price>6000</Price>
        <Color>White</Color>
        <SIMSize>Nano</SIMSize>
        <Memory>4GB</Memory>
        <Camera>Yes</Camera>
        <TouchScreen>Yes</TouchScreen>
        <NoSold>3</NoSold>
        <storeName>store3</storeName>
    </Mobile>
    <Mobile>
        <ModelID>3452</ModelID>
        <Brand>Micromax</Brand>
        <Price>7000</Price>
        <Color>Black</Color>
        <SIMSize>Micro</SIMSize>
        <Memory>8GB</Memory>
        <Camera>Yes</Camera>
        <TouchScreen>Yes</TouchScreen>
        <NoSold>2</NoSold>
        <storeName>store3</storeName>
    </MobiL>
</MobileSales>